title,category,sub_category,price,sale_price,country,alcohol,volume,brand,url,scrapped_time,desc_1,desc_2,desc_3
Bombay Sapphire Gin 1L,Gin,Imported Gin,"10,550","9,900",England,47%,1000ML,Bombay Sapphire,https://liquorworld.com.np/product/bombay-sapphire-gin-1l/,2023-09-25,"Bombay Sapphire is one of the world’s famous gin in its distinctive blue bottle, a tantalizing, smooth and complex taste that you will experience when you sip Bombay Sapphire gin which is described as fresh citrus and juniper flavours combined with an elegant light spicy finish. Developed out of Bombay Dry Gin in the 1980s by Michel Roux.","The incomparable taste of this gin is the result of 10 hand-selected botanicals from exotic locations around the world which includes Juniper Berries from Italy, Lemon Peel from Spain, Coriander from Morocco, Angelica (Root) from Saxony, Orris (Iris Root) from Italy, Grains of Paradise from West Africa, Cubeb Berries from Java, Cassia Bark from Indo-China, Almonds from Spain and Liquorice from China.","The flavours of the botanicals are captured through a delicate distillation process called Vapour Infusion to give Bombay Sapphire its distinctive taste. It is considered as one of the worlds true iconic Gin’s, it is the perfect way to begin the legendary cocktails, the Martini and the G&T."
Monkey 47 Schwarzwald Dry Gin 500ML,Gin,Imported Gin,"9,878","8,980",Germany,47%,500ML,Monkey 47,https://liquorworld.com.np/product/monkey-47-schwarzwald-dry-gin-500ml/,2023-09-25,Monkey 47 is a complex Gin that has great balance between 47 hand-picked botanicals from the Black Forest in Germany. It is blended with natural spring water to maintain the purity in taste.,"Hand-crafted by a small team of expert distillers in the heart of the Black Forest, Germany, this unfiltered, small batch, ulta-premium, craft gin is bottled at 47% ABV.","This Gin unites great British traditions, the spices of India and the rich landscape of the Black Forest. Three months of maturation in earthenware vessels provides its unparalleled suppleness and balance."
Gordon’s Gin 1L,Gin,Imported Gin,"6,700","6,090",England,43%,1L,Gordon’s,https://liquorworld.com.np/product/gordons-gin-1l/,2023-09-25,Gordon’s London Dry Gin is carefully distilled using a secret recipe. A unique blend of finest handpicked juniper berries citrus and other rare herbs and spices combination gives Gordon’s Gin its distinctive crisp taste and fragrant aroma. It’s the taste that’s made Gordon’s the world’s best-selling London Dry gin.,,
Bottega Bacur Distilled Dry Gin 700ML,Gin,Imported Gin,"6,950","6,535",Italy,40%,700ML,Bottega,https://liquorworld.com.np/product/bottega-bacur-distilled-dry-gin-700ml/,2023-09-25,Bottega Bacur Distilled Dry Gin owes its unique character to the botanicals used to produce it.,"Juniper berries, sage leaves and lemon zest are left to macerate in a solution of water and alcohol for a long time; after that, double distillation takes place, clearing the liquid from possible unwanted hints and leading to an elegant distillate with a fine, clean bouquet.","The final features of this Gin are deeply related to its components, and its quality and complexity depend not only on the quantity of plants used, but also on the conditions in which aromatic compounds are extracted from each of them."
Bulldog Gin 750ML,Gin,Imported Gin,"6,421","6,100",England,40%,750ML,Bulldog,https://liquorworld.com.np/product/bulldog-gin-750ml/,2023-09-25,"Bulldog Gin is a true English premium gin handcrafted in England with smooth and harmonious texture with balanced finish and soft juniper note, rendering it the “world’s most mixable London Dry Gin”. This iconic and multi-award winning, Bulldog Gin uses 100% British wheat and water to create smooth, eminently mixable gin with multiple layers of flavours.","It is quadruple distilled in traditional copper pot stills gin, infused with 12 of the rarest and distinctive botanicals, including Lemon from Spain, Lavender from France, Angelica from Germany, White Poppy from Turkey, Dragon Eye from China, Lotus Leaves from China, Almond from Spain, Coriander from Morocco, Juniper from Italy, Oris from Italy, Cassia from Indo-China and Liquorice from China.","Enjoy the Bulldog Gin and Tonic with sliced blueberries, a Bulldog Supersonic Gin and Tonic with cassis and blackberries. Pairs well with Fever-Tree Mediterranean Tonic Water due to its smooth, citrus flavour."
Suntory Roku Gin 700ML,Gin,Imported Gin,"7,200","6,770",Japan,43%,700ML,Suntory,https://liquorworld.com.np/product/suntory-roku-gin-700ml/,2023-09-25,"In Japanese, Roku translates as the number six. Inside every bottle of Roku Gin, you will find six very special botanicals that are sourced in Japan. Sakura flower, Sakura leaf, Yuzu peel, Sencha tea (green tea), Gyokuro tea (refined green tea) and Sanshō pepper, these are the six Japanese botanicals cultivated over four seasons and have been carefully selected to create ROKU, Japan’s authentic craft gin. These represent Suntory’s commitment to only use the best ingredients harvested from the best growing areas in Japan. Every aspect of Roku Gin is crafted by Japanese artisans with a centuries-old tradition of meticulous attention to detail.","Suntory developed its own multiple distillation process as a result of the special features each botanical brings to Roku Gin’s perfectly balanced mix. Unparalleled soft, round and subtly sweet taste.",Nose: Cherry blossom and green tea provide a floral and sweet aroma.
Gilbey’s London Dry Gin 1L,Gin,Imported Gin,"6,500","5,900",England,43%,1L,Gilbey’s,https://liquorworld.com.np/product/gilbeys-london-dry-gin-1l/,2023-09-25,"Gilbey’s London Dry Gin is a classic gin with flavour of juniper and other 11 botanicals. It was founded in London in 1857 by brothers Walter ad Albert Gilbey. This gin has a delicate blend of 12 natural ingredients to achieve the ideal mix of complexity and balance to deliver a smoother, tangy, refreshing dry gin with hints of citrus. The key botanicals are; juniper, lemongrass, orange peel, coriander, kalamansi, angelica root, cinnamon and nutmeg.",Color: Clear.,"Nose: Light, floral juniper base with hints of sweet orange."
Absolut Apeach 1L,Vodka,Imported Vodka,"6,800","6,200",Sweden,40%,1L,Absolut,https://liquorworld.com.np/product/absolut-apeach-1l/,2023-09-25,"(40% Alc) has the complex flavors of natural peach, blended with the grain grown in the rich fields of Southern Sweden. This Vodka is made using all-natural peach flavours and the purest Swedish Vodka, Absolut have created a marvellous vodka! The sweetness and richness that the peach imparts compliments the Vodka and leaves you with a pleasant and uplifting Vodka. It’s smooth and mellow, with a sophisticated and fruity character of peach.",,
8848 Vodka 750ML,Vodka,Domestic Vodka,"2,145","2,060",Nepal,40%,750ML,8848,https://liquorworld.com.np/product/8848-vodka-750ml/,2023-09-25,"Mount Everest, known as Chhomolungma by Sherpas meaning “Mother Goddess of the Earth” is the highest point in the world standing at 8848 meters.","is crafted from imported grain spirits, distilled from Soft French Winter Wheat and blended in small batches with Pure Spring Water from the Himalayas.",The remarkable superior taste comes from the time-honored tradition of using copper in the distilling process. A large copper pot is filled with the eclectic mix of ingredients and the process of distillation is repeated five time until the desired flavor of 8848 Vodka is achieved.
Absolut Blue 1L,Vodka,Imported Vodka,"6,550","5,955",Sweden,40%,1L,Absolut,https://liquorworld.com.np/product/absolut-blue-1l/,2023-09-25,"is a Swedish vodka made exclusively from natural ingredients and distilled from grain grown in the rich fields of southern Sweden. It has been produced at the famous old distilleries near Ahus in accordance with more than 40 years of Swedish tradition. Because it has no added sugar, Absolut Vodka is perfect for mixing. In fact, Absolut is as clean as vodka can be. Still, it has a certain taste: Rich, full-bodied and complex, yet smooth and mellow with a distinct character of grain, followed by a hint of dried fruit.",,
Sailor Jerry Spiced Rum 700ML,Rum,Imported Rum,"7,675","6,900",USA,40%,700ML,Sailor Jerry,https://liquorworld.com.np/product/sailor-jerry-spiced-rum-700ml/,2023-09-25,Norman ‘Sailor Jerry’ Collins was the father of old school tattooing and was a master craftsman whose artistry and integrity remain as timeless as the liquid that bears his signature.,"Sailor Jerry Spiced Rum was developed after loads of historical research into maritime rums. It is blended with local natural spices, namely Vanilla and Lime. The all-natural spices and flavors that gives rum a rich, smooth taste characterized by top notes of vanilla and cinnamon.",Tasting Notes: Flavors of vanilla and oak with hints of clove and cinnamon spices.
Wyborowa Exquisite Vodka 750ML,Vodka,Imported Vodka,"10,329","9,390",Poland,40%,750ML,Wyborowa,https://liquorworld.com.np/product/wyborowa-exquisite-vodka-750ml/,2023-09-25,"Wyborowa Exquisite is a super premium single estate vodka, which means one type of rye, one distillery, one rectification plant and one bottling location.",Wyborowa Exquisite is made from one of the noblest varieties of rye – Dankowskie Diamond. This unique grain gives the vodka a creamy texture with dominant nutty and sweet notes.,The grain used to produce Wyborowa Exquisite comes from fields surrounding traditional rural distillery. The top-quality rectified spirit is diluted with water sourced from an underground spring.
Yeti Vodka 750ML,Vodka,Domestic Vodka,"2,260","2,190",Nepal,40%,750ML,Yeti,https://liquorworld.com.np/product/yeti-vodka-750ml/,2023-09-25,"Introducing, YETI VODKA, Magic in a bottle.",This vodka will take you on a MAGICAL journey of flavours – silky smooth on the palate with a distinctly bright mouthfeel and pleasantly sweet finish.,Quadruple distilled with triple platinum filtered.
The Yamazaki Single Malt Distiller’s Reserve 700ML,Japanese-Liquor,Japanese Liquor,"32,000","30,400",Japan,Single Malt,700ML,Yamazaki,https://liquorworld.com.np/product/the-yamazaki-single-malt-distillers-reserve-700ml/,2023-09-25,43%,Known as “the pioneer of Japanese whisky” Yamazaki® is Japan’s first and oldest distillery.,"Established in 1923 on the periphery of Kyoto, in a unique, misty region water and mountains offer diversity in nature and temperature, where conditions are ideal for ageing whisky lies the birthplace of Japanese whisky and Suntory’s flagship single malt, Yamazaki."
Campari Bitter 1L,Liqueur,Liqueur,"8,825","7,950",Italy,25%,1L,Campari,https://liquorworld.com.np/product/campari-bitter-1l/,2023-09-25,"Campari Bitter is one of the world-famous Italian aperitifs with its distinctive red colour, citrussy aroma and pleasantly bitter-sweet flavour made by infusing 68 bitter herbs, aromatic plants and fruit in alcohol and water. The result is a rich, complex aperitif which can be enjoyed mixed with orange juice, grapefruit juice or soda over ice or in an Americano or Italian Mojito Cocktails.",Color: Red almost burgundy,"Smell: Light flowers, herbal hints, orange peel"
The Yamazaki Single Malt 12 Years 700ML,Japanese-Liquor,Japanese Liquor,"44,000","41,800",Japan,43%,700ML,Yamazaki,https://liquorworld.com.np/product/the-yamazaki-single-malt-12-years-700ml/,2023-09-25,Known as “the pioneer of Japanese whisky” Yamazaki is Japan’s first and oldest distillery.,"Established in 1923 on the periphery of Kyoto, in a unique, misty region water and mountains offer diversity in nature and temperature, where conditions are ideal for ageing whisky lies the birthplace of Japanese whisky and Suntory’s flagship single malt, Yamazaki.","Yamazaki 12-Year-Old offers a characteristically refined Japanese taste, distinguished by an aroma of ripened fruit and a sweet vanilla fragrance thanks to malt whiskies matured in white oak casks. Hidden flavours from the whiskies aged in sherry and mizunara casks produce layer after layer of flavour so the taste never grows tiresome."
Jagermeister 750ML,Liqueur,Liqueur,"5,580","5,075",Germany,35%,750ML,Jagermeister,https://liquorworld.com.np/product/jagermeister-750ml/,2023-09-25,"Jägermeister is the most successful liqueur brand world-wide and ranks on seventh place in the leading Impact International ranking of the international premium spirits. It started with the foundation of the family-owned company in Wolfenbüttel in 1878. 1934 Curt Mast created the secret recipe for Jägermeister, which has remained unchanged since then. Jägermeister herb liqueur is a secret recipe of 56 herbs, roots and fruits. They combine to create a smooth, rich flavour, with a distinctive bitter sweet finish.","Every drop of Jägermeister comes from one of the 445 Oak barrels that live in the factory cellar. In the darkness of their depths, the macerates are left to blend and mature for up to a year until they become liquid German perfection. It has 5 distinct notes; sweet, bitter, fruity, spicy and aromatic.",Best served as an ice-cold shot.
Grand Marnier Liqueur 1L,Liqueur,Liqueur,"17,428","15,650",France,40%,1L,Grand Marnier,https://liquorworld.com.np/product/grand-marnier-liqueur-1l/,2023-09-25,"Grand Marnier is a French brand of Liqueur founded in 1880 by Louis-Alexandre Marnier Lapostolle. It is an orange-flavoured liqueur made from a blend of Cognac brandy, distilled essence of bitter orange, and sugar. Even though it is a flavored liqueur, it has 40% alcohol by volume, which is more than most other flavored liqueurs.",Color: Brilliant amber and topaz tones.,Nose: Vanilla cognac nuances with hints of candied zest.
Jagermeister 1L,Liqueur,Liqueur,"7,400","6,730",Germany,35%,1L,Jagermeister,https://liquorworld.com.np/product/jagermeister-1l/,2023-09-25,"Jägermeister is the most successful liqueur brand world-wide and ranks on seventh place in the leading Impact International ranking of the international premium spirits. It started with the foundation of the family-owned company in Wolfenbüttel in 1878. 1934 Curt Mast created the secret recipe for Jägermeister, which has remained unchanged since then. Jägermeister herb liqueur is a secret recipe of 56 herbs, roots and fruits. They combine to create a smooth, rich flavour, with a distinctive bitter sweet finish.","Every drop of Jägermeister comes from one of the 445 Oak barrels that live in the factory cellar. In the darkness of their depths, the macerates are left to blend and mature for up to a year until they become liquid German perfection. It has 5 distinct notes; sweet, bitter, fruity, spicy and aromatic.",Best served as an ice-cold shot.
Drambuie Liqueur 1L,Liqueur,Liqueur,"15,010","13,500",Scotland,40%,1L,Drambuie,https://liquorworld.com.np/product/drambuie-liqueur-1l/,2023-09-25,"Drambuie Scotch Whisky Liqueur is an extraordinary blend of aged Scotch whisky, spices, herbs and heather honey. It has a bright, deep golden colour with the aromas of aged malt whisky combined with a mix of floral and herbal overtones and rich honey. The flavour provides a kaleidoscopic taste sensation, a complex arrangement of herbal, spicy, sweet and honey notes. It’s voluptuous, mellifluous and full bodied.",Drambuie origins can be traced to a secret recipe created for Bonnie Prince Charlie by his Royal Apothecary in the 18th Century. It is derived from Scots Gaelic ‘A Dram Buidheach’ and means “The Drink that Satisfies”.,
Cointreau Orange Liqueur 1L,Liqueur,Liqueur,"14,682","13,200",France,40%,1L,Cointreau,https://liquorworld.com.np/product/cointreau-orange-liqueur-1l/,2023-09-25,"Cointreau Orange is a premium orange flavoured liqueur produced in Saint-Bartheemy-d’Anjou, France that was established in 1849. It is crafted through the unique distillation of sweet and bitter orange peels, features only 100% natural ingredients, resulting in a crystal-clear liqueur that strikes the perfect balance between sweetness and freshness.","Cointreau is well recognised as a cocktail elevator with limitless versatility: it is at the original heart of some of the most famous classic cocktails since their creation, such as the Sidecar, Margarita, White Lady and Cosmopolitian.",Enjoyed as a refreshing long drink topped with soda and a squeeze of lime.
Benedictine DOM 1L,Liqueur,Liqueur,"15,140","13,600",France,40%,1L,Benedictine,https://liquorworld.com.np/product/benedictine-dom-1l/,2023-09-25,"Benedictine is a French herbal liqueur, produced since the 1800s. Distilled and aged in a flamboyant palace, built in Fécamp. Bénédictine D.O.M is a secret recipe of 27 traditional roots, herbs and spices from five continents. These include a blend of herbs, spices and an infusion of saffron, honey, thyme, tea and caramel. The quality of ingredients and the maturation of Benedictine in oak casks for three months combine to produce a truly unique spirit.","The D.O.M. title, ‘Deo Optimo Maximo’ is Latin and translates as ‘To God most good, most great.’ One of the best liqueurs of the century!","Colour: Rich, coppery with golden highlights."
Baileys Original 1L,Liqueur,Liqueur,"7,300","6,640",Ireland,17%,1L,Baileys,https://liquorworld.com.np/product/baileys-original-1l/,2023-09-25,"One of life’s most pleasurable indulgences, Baileys Original Irish Cream is the sweetest belnd of fine Irish whiskey and spirits, Irish dairy cream, rich chocolate and vanilla flavours resulting a complete deliciousness.","Drink neat over ice, shake into cocktails, drizzle over ice-cream, bake a Baileys-tastic cake – perhaps even share it if you have to – Baileys Original Irish Cream equals pure, unadulterated pleasure.","Go on, you know you want to!"
Martini Rosso 1L,Liqueur,Liqueur,"3,250","3,100",Italy,15%,1000ML,Martini,https://liquorworld.com.np/product/martini-rosso-1l/,2023-09-25,"Martini Rosso is an Italian vermouth, first created by Martini in 1863, which claimed to be the world’s first vermouth.","This sweet vermouth’s intensely herbal character is the result of blending carefully chosen wines with a complex selection of Italian herbs, including sage, savory and dittany, and bitter-sweet exotic woods.","The distinctive colour is produced by the addition of caramel, which also tempers the bittersweet effect of the 50+ herbs and spices used in production."
Smirnoff Blue Vodka 1L,Vodka,Imported Vodka," 6,950",N/A,Russia,50%,1L,Smirnoff,https://liquorworld.com.np/product/smirnoff-blue-vodka-1l/,2023-09-25,"Smirnoff Blue is the Super-Premium vodka of the Smirnoff family, with triple distillation and ten passes through filtration for maximum purity and exceptional smoothness. This is the export strength version of Smirnoff Blue, bottled at 50% and their highest strength expression on the market. This Smirnoff 100% Proof vodka is Kosher Certified and gluten free.","Tasting Notes: Clean, clear and crisp vodka with a clean, grainy nose and a hint of sweetness. Both sweet and strong with a hint of vanilla.",Give your cocktails or mixers an extra added kick.
Smirnoff Black Vodka 1L,Vodka,Imported Vodka," 6,650",N/A,Russia,40%,1L,Smirnoff,https://liquorworld.com.np/product/smirnoff-black-vodka-1l/,2023-09-25,"Smirnoff Black Label Vodka is crafted in small batches using a 150-year-old copper still to create a vodka that is wonderfully complex and concentrated. The special distillation process produces a rounder, more refined palate that is ideally suited to enjoying in classic cocktails, like a Vodka Martini.",This premium variant of Smirnoff is pot-distilled and filtered through seven tons of charcoal in a painstaking production process designed to produce a vodka of rare purity.,
Highlander Vodka 750ML,Vodka,Domestic Vodka,"1,140","1,120",Nepal,34.3%,750ML,Highlander,https://liquorworld.com.np/product/highlander-vodka-750ml/,2023-09-25,"Highlander Pure White Vodka is refreshingly smooth and delicious vodka made with aged golden grain spirit and natural Himalayan glacier water only. Crafted with 100% pure spirit filtered by special Russian Triple Filtration process, to deliver an unmatched drinking experience.",,
Grey Goose Vodka 1L,Vodka,Imported Vodka,"12,500","11,750",France,40%,1L,Grey Goose,https://liquorworld.com.np/product/grey-goose-vodka-1l/,2023-09-25,"Grey Goose Vodka is made from the best ingredients from France, soft winter wheat and Gensac spring water. It is produced using a five-step distillation process in a copper pot still using a selection of the finest grains. Blended with water naturally purified through champagne limestone from the Gente Springs in Cognac, France; Grey Goose is created under the watchful eye of a master distiller.","Grey Goose claims to make the “World’s best tasting vodka”. Once poured over ice, it is very hard to argue with them!",Nose: Delicate & Floral.
Gran Vina Semi Sweet Red 750ML,Wine,Red Wine,"1,100","1,025",Spain,10.5%,750ML,Gran Vina,https://liquorworld.com.np/product/gran-vina-semi-sweet-red-750ml/,2023-09-25,Semi sweet red wine made with Tempranillo and Garnacha grapes from a very famous family winery.,"Goes well with barbecue meats, pasta, rice, casseroles and fowl.",Serving Temperature: 12°-14° C.
Pernod Paris 1L,Liqueur,Liqueur,"5,720","5,400",France,40%,1L,Pernod,https://liquorworld.com.np/product/pernod-paris-1l/,2023-09-25,"Pernod Paris is a traditional French liqueur referred to as a “pastis”, with a distinct aniseed flavour. It is made from distillates of star anise and fennel, married with distillates of 14 herbs including camomile, coriander and veronica.","Tasting Note: An electric green colouring with herb, liquorice and citrus aroma, and a smooth and sweet medium palate, featuring lingering white pepper and strong anise qualities.",Best served long with water and plenty of ice.
Vina Pomal Crianza 750ML26,Wine,Red Wine,"2,859","2,660",Spain,14%,750ML,Vina Pomal,https://liquorworld.com.np/product/vina-pomal-crianza-750ml/,2023-09-25,Tempranillo,Colour: Picota cherry red with violet hues.,"Nose: High aromatic intensity. Flowers, black fruits and liquorice with hints of vanilla and roasted coffee."
Martini Extra Dry 1L,Liqueur,Liqueur,"3,250","3,100",Italy,18%,1L,Martini,https://liquorworld.com.np/product/martini-extra-dry-1l/,2023-09-25,"Martini Extra Dry introduced on New Year’s Day 1900. Its rare woods, herbs, citrus and raspberry extracts are the pillar of the 20th century’s defining drink: the Dry Martini cocktail.","Elegant, delicate and very cool, it is the essential ingredient and the perfect mixer. Characterised by its pale colour and fresh and fruity aromas, Martini Extra Dry is delicious over ice with lemonade or apple juice.",
Le Favori Triple Sec 700ML,Liqueur,Liqueur,"5,500","5,000",France,40%,700ML,Le Favori,https://liquorworld.com.np/product/le-favori-triple-sec-700ml/,2023-09-25,"Le Favori Triple Sec is an orange-flavoured French liqueur made from the dried peels of bitter and sweet orange. Triple sec may be consumed neat as a digestif or on the rocks, but nowadays is mostly used in making cocktails such as the Margarita, White Lady, and Cosmopolitan.","A symphony with the exotic aroma, fruity and ripe oranges; intoxicating sweet and spicy taste.",
Molinari Sambuca Extra Liqueur 1L,Liqueur,Liqueur,"12,879","11,550",Italy,40%,1L,Molinari,https://liquorworld.com.np/product/molinari-sambuca-extra-liqueur-1l/,2023-09-25,"Created in 1945 by Angelo Molinari and now one of Italy’s most celebrated masterpieces- a smooth, rich, full-bodied liqueur he proudly named Molinari Sambuca.",Molinari Sambuca is the best-selling liqueur in Italy and the most cherished Sambuca in the world. It is the only brand permitted by Italian law to use the term ‘Extra’ because of its extra quality.,"Sweet and strong, this Italian liqueur is made from a secret recipe that includes star anise pods, sugar, herbs and other spice. Its distinctive anise aroma and flavor is perfect neat, on the rocks, with a few coffee beans added or in cocktails."
Vesper Vino Rosato IGP 750ML,Wine,Rose Wine,"1,925","1,790",Italy,12.5%,750ML,Vesper,https://liquorworld.com.np/product/vesper-vino-rosato-igp-750ml/,2023-09-25,"Sangiovese, Merlot, Montepulciano",Colour: Intense pink in colour.,"Nose: Characterized by fresh, fragrant light and persistent bouquet."
Terra De Pau Blanc 750ML,Wine,White Wine,"2,350","2,185",Spain,12%,750ML,Terra De Pau,https://liquorworld.com.np/product/terra-de-pau-blanc-750ml/,2023-09-25,"White Grenache, Macabeo","Pale lemon-green color, this wine stands out for its freshness and aromatic richness.",Dry and light body if you compare with the wines from this region.
Terra De Pau Negre 750ML,Wine,Red Wine,"2,350","2,185",Spain,13%,750ML,Terra De Pau,https://liquorworld.com.np/product/terra-de-pau-negre-750ml/,2023-09-25,"Garnacha, Merlot, Cabernet Sauvignon, Tempranillo",Red color with purple hints indicative of its youth.,"It is a fruity, fresh and balanced wine with medium body."
Parxet Cava Brut Reserva 750ML,Wine,Sparkling Wine,"3,095","2,880",Spain,11.5%,750ML,Parxet,https://liquorworld.com.np/product/parxet-cava-brut-reserva-750ml/,2023-09-25,"Pansa Blanca, Macabeo, Parellada","Colour: Pale in hue with a greenish tinge, fine, persistent bubbles and good mousse.",Nose: Delicate aromas of white fruits with more complex aromas coming from the ageing.
Stanley Chardonnay 4L,Wine,White Wine,"6,800","6,325",Australia,12.5%,4L,Stanley,https://liquorworld.com.np/product/stanley-chardonnay-4l/,2023-09-25,"A full-flavoured white wine with notes of peach, tropical fruits and hints of oak.",Colour: Medium straw.,Nose: Lifted tropical aromas with hints of peach and vanilla overtones.
