title,category,sub_category,price,sale_price,country,alcohol,volume,brand,url,scrapped_time,desc_1,desc_2,desc_3
Kala Patthar Blended Reserve 750ML,Whisky,Domestic Whisky,"2,775","2,665",Nepal,42.8%,750ML,Kala Patthar,https://liquorworld.com.np/product/kala-patthar-blended-reserve-750ml/,2023-09-25,"Kala Patthar, Blended Reserve Whisky, is inspired by the famous vantage point above the Khumbu Glacier at 5643M for viewing Mt. Everest. An epic destination for adventurers and mountaineers alike.","Matured in Sherry and Oak cask from Scotland, Kala Patthar is a full-bodied whisky that is blended with the best Nepalese grain spirits and the pristine glacial water of the Himalayas.","The distinct blend takes you on an adventure of exquisite taste. It starts from the sweetness of creamy toffee and the wonderful flavour of wild orchard fruits to the warmth of winter spice. You will experience the luxurious notes of smoky malt with hints of exotic vanilla, all resulting in a rich and smooth finish of marvelous character."
Yarchagumba Golden Sapphire 750ML,Whisky,Premium Whisky,"11,000","10,350",Nepal,40%,750ML,Yarchagumba,https://liquorworld.com.np/product/yarchagumba-golden-sapphire-750ml/,2023-09-25,Yarchagumba is a legendary herbal substance that is found in the mountain pastures of Nepal at an altitude of 4000-5000 meters.,"It is a century old, widely trusted medicinal herb, beneficial to people with various medical conditions. It is famously known as the Himalayan Aphrodisiac and is an anti-aging tonic that adds natural charm to the attainment of a long healthy life.",Yarchagumba Health Beverage is a specially formulated drink in which Yarchagumba has been blended with alcohol and multiple natural herbs to provide the most beneficial extract.
Virgin Black 750ML,Whisky,Domestic Whisky,"1,120","1,100",Nepal,34.3%,750ML,Virgin,https://liquorworld.com.np/product/virgin-black-750ml/,2023-09-25,Virgin is premium blend of finest domestic spirits and scotch malts.,,
Virgin Gold 750ML,Whisky,Domestic Whisky,"1,160","1,140",Nepal,34.3%,750ML,Virgin,https://liquorworld.com.np/product/virgin-gold-750ml/,2023-09-25,Virgin Gold is a premium blended whisky.,,
Vat 69 750ML,Whisky,Regular Whisky,"4,750","4,320",Scotland,40%,750ML,VAT 69,https://liquorworld.com.np/product/vat-69-750ml/,2023-09-25,Vat 69 is a blended Scotch Whisky produced by William Sanderson & Son Limited. Blended using 40 different malt and grain whiskies with each other at the optimal ripening stage to ensure the best blend.,"It is smooth, balanced spirit with upfront malty, heather sweetness and a lovely peat smoke savoury finish.","Nose: shows caramel, lemon zest, and soft wood spices."
The Glenlivet 15 Years 700ML,Whisky,Single Malt Whisky,"12,000","10,910",Scotland,40%,700ML,The Glenlivet,https://liquorworld.com.np/product/the-glenlivet-15-years-700ml/,2023-09-25,"The Glenlivet 15 Years Old Single Malt Speyside Scotch Whisky gets its distinctive rich and exotic character from a process of selective maturation in which a proportion of the spirit is matured in French oak casks. In fact, The Glenlivet were one of the first to use French oak for making whisky, a technique that has since been imitated the world over.","The Limousin oak that is used is cut in France’s Dordogne region, where it’s often used to mature cognacs. Its low density allows whisky to sink deep into the wood, and carefully control how long the whisky matures in the casks so as not to overpower the desired result: a unique, pleasing spiciness.","Colour: Deep, intense gold."
Tullamore Dew Irish 1L,Whisky,Regular Whisky,"8,897","8,000",Ireland,40%,1L,Tullamore Dew,https://liquorworld.com.np/product/tullamore-dew-irish-1l/,2023-09-25,"Tullamore Dew Irish Whisky is first blended in 1829 in the small Irish town of Tullamore in County Offaly. It takes its name from one of the earliest influencers of the newly established distillery, Daniel E Williams (DEW).","Triple distilled and patiently aged in a combination of ex-bourbon and sherry casks, this original blended Irish whisky is known the world over for its smooth and gentle complexity.",Colour: Bright gold.
The Glenlivet 25 Years XXV 700ML,Whisky,Single Malt Whisky,"70,388","63,990",Scotland,43%,700ML,The Glenlivet,https://liquorworld.com.np/product/the-glenlivet-25-years-xxv-700ml/,2023-09-25,"The Glenlivet 25 Years Old XXV Single Malt Speyside Scotch Whisky is the perfect tribute to the skill and judgement of the craftsmen involved in making this special whisky. Using some of the rarest Glenlivet whiskies, all of which have been aged for at least 25 years, this is a batch-produced whisky finished in individually selected ex-sherry butts. The Oloroso-soaked oak imparts a nutty spiciness and enriches the flavour of the expression. Each cask is individually monitored in the finishing process to ensure only the subtlest sherry tones are added to this intense, silky and elegant whisky.","Color: Rich amber, golden shades.",Cask: Oloroso Sherry Oak.
The Glenlivet 12 Years 750ML,Whisky,Single Malt Whisky,"8,256","7,600",Scotland,43%,750ML,The Glenlivet,https://liquorworld.com.np/product/the-glenlivet-12-years-750ml/,2023-09-25,"Smooth, balanced, fruity, complex, sophisticated, entertaining, classic … an invitation to indulgence in liquid form. This is one of Speyside’s definitive malts. Deceptively complex, The Glenlivet 12 Years Old Single Malt Speyside Scotch Whisky is one of the classiest, most sophisticated malts.","This classic malt is first matured in traditional oak, before spending time in American oak casks which impart notes of vanilla and gives the whisky its distinctive smoothness. The mineral-rich water that comes from Josie’s Well helps form the flavours during mashing and fermentation, whilst the specific height and width of the copper stills add a delicate yet complex character. Keep a bottle on hand for every occasion.","Colour: Bright, vibrant gold."
The Glenlivet 12 Years 1L,Whisky,Single Malt Whisky,"10,750","9,775",Scotland,43%,1L,The Glenlivet,https://liquorworld.com.np/product/the-glenlivet-12-years-1l/,2023-09-25,"Smooth, balanced, fruity, complex, sophisticated, entertaining, classic … an invitation to indulgence in liquid form. This is one of Speyside’s definitive malts. Deceptively complex, The Glenlivet 12 Years Old Single Malt Speyside Scotch Whisky is one of the classiest, most sophisticated malts.","This classic malt is first matured in traditional oak, before spending time in American oak casks which impart notes of vanilla and gives the whisky its distinctive smoothness. The mineral-rich water that comes from Josie’s Well helps form the flavours during mashing and fermentation, whilst the specific height and width of the copper stills add a delicate yet complex character. Keep a bottle on hand for every occasion.","Colour: Bright, vibrant gold."
J89 Single Barrel Malt 750ML,Whisky,Domestic Whisky,"2,999","2,850",Nepal,40%,750ML,J89,https://liquorworld.com.np/product/j89-single-barrel-malt-750ml/,2023-09-25,"“J” is a De-code for a batch of rare Irish oak casks that was handcrafted immaculately in the year 1989. These two-decade old barrels are the same in which the malt of J89 has been mellowed and matured, giving it its woody aroma.",The peaty taste simulates the subtle lapsang souchong and the triple distillation ensures every drop is exceptionally smooth.,This vintage malted Whiskey of the single malt class is married with natural waters extracted from pockets 155 meters deep beneath the midhills of Nepal.
Barahsinghe Craft Hazy IPA Bottle 330ML,Beer,Domestic Beer, 225,N/A,Nepal,5.5%,330ML,Barahsinghe,https://liquorworld.com.np/product/barahsinghe-craft-hazy-ipa-bottle-330ml/,2023-09-25,"Barahsinghe Hazy IPA, a version of India Pale Ale, has a signature hazy appearance, fruity, juicy flavours without the extreme bitterness.","Brewed using an array of nine aromatic hops. Our Hazy IPA is dry-hopped with the hops varieties from the USA and England, which provides a more fruit-forward flavour and aroma and moderate bitterness.","Combines Maris Otter malt, malted wheat, oats, aromatic malts along with nine hop varieties. The marisotter malt adds a rich malty, nutty flavour, and the wheat and oats give our beer a hazy appearance and creamy, soft mouthfeel. The use of different aromatic hops imparts flavours and aromas of mango, orange, pineapple, peach and berries."
J&B Rare 1L,Whisky,Regular Whisky,"7,000","6,400",Scotland,40%,1L,J&B,https://liquorworld.com.np/product/jb-rare-1l/,2023-09-25,"Inspired by an Italian, created in London, distilled in Scotland, the J&B Rare is the original result of blending 42 single malt and grain whiskies and carefully blends them to create a subtle, smooth and complex flavour.","A creation that defied whisky conventions, which comes in and comes out as a unique style featuring a smooth, fruity taste that brings freshness to each and every one of our modern mixes and surprising flavours.","Nose: Soft, with a subtle floral and fruity aroma."
J89 Select Cask Double Wood 12 Years 750ML,Whisky,Domestic Whisky,"4,512","4,285",Nepal,42.8%,750ML,J89,https://liquorworld.com.np/product/j89-select-cask-double-wood-12-years-750ml/,2023-09-25,"Quality barley is the foundation to any good whisky. This is why the J89 Double Wood Edition finds its origin in the finest selection of Scottish barley, which creates the base for the final rich, aromatic flavors.","By blending our 12-year-old Scotch Malts with matured spirits, aging it in Scottish J White Oak Barrels, and finishing it in the celebrated Pedro Ximenez Sherry Casks from Spain, we have concocted a unique whisky that brings you a complex yet rich flavor profile and depth.",COLOUR: Light amber hue intertwined with gleams of gold.
Barahsinghe Craft Hazy IPA 330ML x 24 Bottles,Beer,Beer Case,"5,400","5,130",Nepal,5.5%,330ML x 24 Bottles,Barahsinghe,https://liquorworld.com.np/product/barahsinghe-craft-hazy-ipa-330ml-x-24-bottles/,2023-09-25,"Barahsinghe Hazy IPA, a version of India Pale Ale, has a signature hazy appearance, fruity, juicy flavours without the extreme bitterness.","Brewed using an array of nine aromatic hops. Our Hazy IPA is dry-hopped with the hops varieties from the USA and England, which provides a more fruit-forward flavour and aroma and moderate bitterness.","Combines Maris Otter malt, malted wheat, oats, aromatic malts along with nine hop varieties. The marisotter malt adds a rich malty, nutty flavour, and the wheat and oats give our beer a hazy appearance and creamy, soft mouthfeel. The use of different aromatic hops imparts flavours and aromas of mango, orange, pineapple, peach and berries."
Nepal Ice Craft Pilsner 330ML x 24 Bottles,Beer,Beer Case,"4,560","4,330",Nepal,5%,330ML x 24 Bottles,Nepal Ice Pilsner,https://liquorworld.com.np/product/nepal-ice-craft-pilsner-330ml-x-24-bottles/,2023-09-25,Nepal Ice Craft Pilsner brings thirst quenching aromatic flavour to satisfy your palate.,"It is delicious and crisp, with a perfect hop balance.",
Tuborg 330ML x 24 Bottles + 2 Bottles Free,Beer,Beer Case,"5,280","5,015",Nepal,5.5%,330ML,Tuborg,https://liquorworld.com.np/product/tuborg-330ml-x-24-bottles-2-bottles-free/,2023-09-25,"Tuborg is a bottom-fermented larger beer. It’s brewed on lager malt, a slightly roasted, bright type of malt which result is the well-known mild, fresh taste and aroma of flowers and grain. The beer is medium rich and lively with a moderate bitterness in the aftertaste.","Launched in Nepal in 1990 and enjoyed worldwide since 1880, Tuborg is the largest selling, most preferred and therefore the number 1 beer brand in Nepal.",Tuborg recently unveiled its new look with the innovative Pull-Off Cap for the first time in Nepal.
Nepal Ice Xtra Strong Bottle 330ML,Beer,Domestic Beer, 167,N/A,Nepal,8%,330ML,Nepal Ice,https://liquorworld.com.np/product/nepal-ice-xtra-strong-bottle-330ml/,2023-09-25,"The excellent taste of Nepal comes from the perfect blend of the finest malts and grains, best hops and pure yeast.","Ingredients: Malted barley, hops, rice, yeast, and water.",
Nepal Ice Xtra Strong 330ML x 24 Bottles,Beer,Beer Case,"4,008","3,800",Nepal,8%,330ML x 24 Bottles,Nepal Ice,https://liquorworld.com.np/product/nepal-ice-xtra-strong-330ml-x-24-bottles/,2023-09-25,"The excellent taste of Nepal comes from the perfect blend of the finest malts and grains, best hops and pure yeast.","Ingredients: Malted barley, hops, rice, yeast, and water.",
Barahsinghe Craft Maris Otter Pale Ale Bottle 650ML,Beer,Domestic Beer, 445,N/A,Nepal,5.5%,650ML,Barahsinghe,https://liquorworld.com.np/product/barahsinghe-craft-maris-otter-pale-ale-bottle-650ml/,2023-09-25,Barahsinghe Pale Ale is brewed with Maris Otter Malt from England and Aromatic Hops.,"This English-style Pale Ale has a malty, full-bodied profile along with balanced hop bitterness and fruity notes.",Ingredients:
Barahsinghe Craft Maris Otter Pale Ale 650ML x 12 Bottles,Beer,Beer Case,"5,340","5,070",Nepal,5.5%,650ML x 12 Bottles,Barahsinghe,https://liquorworld.com.np/product/barahsinghe-craft-maris-otter-pale-ale-650ml-x-12-bottles/,2023-09-25,Barahsinghe Pale Ale is brewed with Maris Otter Malt from England and Aromatic Hops.,"This English-style Pale Ale has a malty, full-bodied profile along with balanced hop bitterness and fruity notes.",Ingredients:
Carlsberg Danish Pilsner 500ML x 12 Cans,Beer,Beer Case,"4,380","4,160",Nepal,5%,500ML x 12 Cans,Carlsberg,https://liquorworld.com.np/product/carlsberg-danish-pilsner-500ml-x-12-cans/,2023-09-25,"Carlsberg Pilsner is a premium Danish lager with a 5% ABV. It’s a wonderfully crisp and refreshing, with a full flavour and a distinctive hoppy aroma.","Carlsberg Danish Pilsner is brewed with the principals learned from over 100 years brewing experience to produce a lager with distinctive citrus and floral hop aromas that delivers great depth of flavor, making it the perfect beer for those that value authentic and quality drinking experiences.",
Carlsberg Danish Pilsner Can 500ML,Beer,Domestic Beer, 365,N/A,Nepal,5%,500ML CAN,Carlsberg,https://liquorworld.com.np/product/carlsberg-danish-pilsner-can-500ml/,2023-09-25,"Carlsberg Pilsner is a premium Danish lager with a 5% ABV. It’s a wonderfully crisp and refreshing, with a full flavour and a distinctive hoppy aroma.","Carlsberg Danish Pilsner is brewed with the principals learned from over 100 years brewing experience to produce a lager with distinctive citrus and floral hop aromas that delivers great depth of flavor, making it the perfect beer for those that value authentic and quality drinking experiences.",
Barahsinghe Craft Hazy IPA 650ML x 12 Bottles,Beer,Beer Case,"5,340","5,070",Nepal,5.5%,650ML x 12 Bottles,Barahsinghe,https://liquorworld.com.np/product/barahsinghe-craft-hazy-ipa-650ml-x-12-bottles/,2023-09-25,"Barahsinghe Hazy IPA, a version of India Pale Ale, has a signature hazy appearance, fruity, juicy flavours without the extreme bitterness.","Brewed using an array of nine aromatic hops. Our Hazy IPA is dry-hopped with the hops varieties from the USA and England, which provides a more fruit-forward flavour and aroma and moderate bitterness.","Combines Maris Otter malt, malted wheat, oats, aromatic malts along with nine hop varieties. The marisotter malt adds a rich malty, nutty flavour, and the wheat and oats give our beer a hazy appearance and creamy, soft mouthfeel. The use of different aromatic hops imparts flavours and aromas of mango, orange, pineapple, peach and berries."
Barahsinghe Craft Hazy IPA Bottle 650ML,Beer,Domestic Beer, 445,N/A,Nepal,5.5%,650ML,Barahsinghe,https://liquorworld.com.np/product/barahsinghe-craft-hazy-ipa-bottle-650ml/,2023-09-25,"Barahsinghe Hazy IPA, a version of India Pale Ale, has a signature hazy appearance, fruity, juicy flavours without the extreme bitterness.","Brewed using an array of nine aromatic hops. Our Hazy IPA is dry-hopped with the hops varieties from the USA and England, which provides a more fruit-forward flavour and aroma and moderate bitterness.","Combines Maris Otter malt, malted wheat, oats, aromatic malts along with nine hop varieties. The marisotter malt adds a rich malty, nutty flavour, and the wheat and oats give our beer a hazy appearance and creamy, soft mouthfeel. The use of different aromatic hops imparts flavours and aromas of mango, orange, pineapple, peach and berries."
Sagatiba Pura Cachaca 1L,Rum,Imported Rum,"15,630","14,100",Brazil,40%,1L,Sagatiba,https://liquorworld.com.np/product/sagatiba-pura-cachaca-1l/,2023-09-25,"Sagatiba Cachaca is the Brazilian national spirit, refined from sugar cane. Cachaca is not unlike rum, the only differences being that it is distilled from sugar cane and not molasses as rum is, and that it must be produced in Brazil to carry the name Cachaca.","Sagatiba Pura Cachaca is a very clean spirit with the delicate flavour and aroma of fresh cut sugarcane. Sagatiba Pura’s unmatched versatility and mixability add Brasilian flair to any of your favourite cocktails, namely the classic favourite Caipirinha.",
Havana Club 7 Years 1L,Rum,Imported Rum,"6,540","5,885",Cuba,40%,1L,Havana Club,https://liquorworld.com.np/product/havana-club-7-years-1l/,2023-09-25,"Havana Club 7 Years Black is a stylish and exceptionally rich rum that holds the tastes of the Cuban terroir: aromatic tobacco, the sweet tropical fruits of the Cuban garden, molasses, spices and vanilla from the long ageing unfold, enhanced by the slow release of aromas.",It is a dark rum matured in barrels reveals the rich natural flavours of Cuba.,
Captain Morgan Black 1L,Rum,Imported Rum,"6,600","6,000",United States of America,40%,1L,Captain Morgan,https://liquorworld.com.np/product/captain-morgan-black-1l/,2023-09-25,"Captain Morgan Black is crafted from authentic Caribbean rum, and named after the famous pirate, has a distinctive dark colour and a premium, smooth taste. The blend of Caribbean rum is refined with exquisite spices such as cloves, cinnamon and cassia, making it wonderfully spicy. The final refinement is achieved by ageing it in charred oak barrels.","With its bold flavour and delicious silky finish, you can enjoy it on the rocks or with some cola and a slice of lime or with ginger ale for a true taste of the Caribbean.",
Barahsinghe Craft Pilsner 500ML x 12 Cans,Beer,Beer Case,"3,720","3,535",Nepal,5%,500ML x 12 Cans,Barahsinghe,https://liquorworld.com.np/product/barahsinghe-craft-pilsner-500ml-x-12-cans/,2023-09-25,Barahsinghe Craft is Nepal’s first dry hopped beer but with a Pilsner style finish.,"Brewed with imported German Malted Barley, Natural Spring Water and Aromatic Hops, this beer with floral, woody and spicy aromatics will certainly please your palate.","Ingredients: Malted Barley, Rice, Hops, Yeast and Natural Spring Water."
Captain Morgan Spiced Gold 1L,Rum,Imported Rum,"6,700","6,090",United States of America,35%,1L,Captain Morgan,https://liquorworld.com.np/product/captain-morgan-spiced-gold-1l/,2023-09-25,Captain Morgan Spiced Gold is a smooth and medium bodied rum made from the finest Caribbean rum expertly blended with adventurous spice and natural flavours. A secret recipe of adventurous spice & natural flavours that are expertly blended with fine Caribbean rum – then aged in charred white oak barrels to create a taste and colour as rich as a pocketful of gold doubloons. For a smooth and refreshing tasting drink.,"Tasting Notes: Notes of rich natural vanilla, brown sugar, dried fruit, warming spices with hints of oak, come together to create a perfectly balanced spirit with a smooth finish.","Captain Morgan Original Spiced Gold is best served in a tankard over ice, with cola and a slice of lime."
Khukri Coronation Rum 375ML,Rum,Domestic Rum,"2,600","2,500",Nepal,42.8%,375ML,Khukri,https://liquorworld.com.np/product/khukri-coronation-rum-375ml/,2023-09-25,"Introduced in 1974, Coronation Rum marks the coronation of His Royal Highness Bir Bikram Shah Dev. Filled in hand crafted bottles in the shape of the historic Khukri, the Coronation Rum carries a valiant sophistication in its taste and style.","Each bottle is individually hand crafted to the shape of the Khukuri, a dagger symbolic of Nepalese history and traditions.","Its uniquely rough finish speaks of the person it was made by and of the times it blends unto itself. From 1974 up until now, the Coronation Rum echoes a history, while giving you a taste of the present, crafted by hands encompassing decades."
Barahsinghe Craft Pilsner 330ML x 24 Bottles,Beer,Beer Case,"4,920","4,675",Nepal,5%,330ML x 24 Bottles,Barahsinghe,https://liquorworld.com.np/product/barahsinghe-craft-pilsner-330ml-x-24-bottles/,2023-09-25,Barahsinghe Craft is Nepal’s first dry hopped beer but with a Pilsner style finish.,"Brewed with imported German Malted Barley, Natural Spring Water and Aromatic Hops, this beer with floral, woody and spicy aromatics will certainly please your palate.","Ingredients: Malted Barley, Rice, Hops, Yeast and Natural Spring Water."
Barahsinghe Eight Super Strong Bottle 330ML,Beer,Domestic Beer, 172,N/A,Nepal,8%,330ML,Barahsinghe,https://liquorworld.com.np/product/barahsinghe-eight-super-strong-bottle-330ml/,2023-09-25,Nepal’s first Black Lager Beer.,Barahsinghe Eight is a crisp and balanced premium strong beer from Nepal.,"Brewed with Imported Roasted Dutch Malt Barley, imported German Wheat, Natural Spring Water and imported German Hops, this beer with floral aroma and refreshing taste will certainly please your palate."
Barahsinghe Eight Super Strong 330ML x 24 Bottles,Beer,Beer Case,"4,128","3,920",Nepal,8%,330ML x 24 Bottles,Barahsinghe,https://liquorworld.com.np/product/barahsinghe-eight-super-strong-330ml-x-24-bottles/,2023-09-25,Nepal’s first Black Lager Beer.,Barahsinghe Eight is a crisp and balanced premium strong beer from Nepal.,"Brewed with Imported Roasted Dutch Malt Barley, imported German Wheat, Natural Spring Water and imported German Hops, this beer with floral aroma and refreshing taste will certainly please your palate."
Barahsinghe Craft Maris Otter Pale Ale Bottle 330ML,Beer,Domestic Beer, 225,N/A,Nepal,5.5%,330ML,Barahsinghe,https://liquorworld.com.np/product/barahsinghe-craft-maris-otter-pale-ale-bottle-330ml/,2023-09-25,Barahsinghe Pale Ale is brewed with Maris Otter Malt from England and Aromatic Hops.,"This English-style Pale Ale has a malty, full-bodied profile along with balanced hop bitterness and fruity notes.",Ingredients:
Gorkha Strong Beer Can 500ML,Beer,Domestic Beer, 265,N/A,Nepal,6%,500ML Can,Gorkha,https://liquorworld.com.np/product/gorkha-strong-beer-can-500ml/,2023-09-25,Gorkha Strong was launched to the market in 2013 to cater those segments that prefer stronger beers. It is a malt liquor beer in the best quality. Gorkha Strong serves as a reward to those who want to relax with a strong beer after a long day of hard work.,Embodying the brave spirits of heroic Gorkha Soldiers!,Dedicated to the Brave!
Gorkha Strong Beer Bottle 650ML,Beer,Domestic Beer, 325,N/A,Nepal,6%,650ML,Gorkha,https://liquorworld.com.np/product/gorkha-strong-beer-bottle-650ml/,2023-09-25,Gorkha Strong was launched to the market in 2013 to cater those segments that prefer stronger beers. It is a malt liquor beer in the best quality. Gorkha Strong serves as a reward to those who want to relax with a strong beer after a long day of hard work.,Embodying the brave spirits of heroic Gorkha Soldiers!,Dedicated to the Brave!
Barahsinghe Craft Maris Otter Pale Ale 330ML x 24 Bottles,Beer,Beer Case,"5,400","5,130",Nepal,5.5%,330ML x 24 Bottles,Barahsinghe,https://liquorworld.com.np/product/barahsinghe-craft-maris-otter-pale-ale-330ml-x-24-bottles/,2023-09-25,Barahsinghe Pale Ale is brewed with Maris Otter Malt from England and Aromatic Hops.,"This English-style Pale Ale has a malty, full-bodied profile along with balanced hop bitterness and fruity notes.",Ingredients:
Tuborg Beer Can 500ML,Beer,Domestic Beer, 335,N/A,Nepal,5.5%,500ML Can,Tuborg,https://liquorworld.com.np/product/tuborg-beer-can-500ml/,2023-09-25,"Tuborg is a bottom-fermented larger beer. It’s brewed on lager malt, a slightly roasted, bright type of malt which result is the well-known mild, fresh taste and aroma of flowers and grain. The beer is medium rich and lively with a moderate bitterness in the aftertaste.","Launched in Nepal in 1990 and enjoyed worldwide since 1880, Tuborg is the largest selling, most preferred and therefore the number 1 beer brand in Nepal.",Tuborg recently unveiled its new look with the innovative Pull-Off Cap for the first time in Nepal.
Carlsberg Danish Pilsner Bottle 650ML,Beer,Domestic Beer, 465,N/A,Nepal,5%,650ML,Carlsberg,https://liquorworld.com.np/product/carlsberg-danish-pilsner-bottle-650ml/,2023-09-25,"Carlsberg Pilsner is a premium Danish lager with a 5% ABV. It’s a wonderfully crisp and refreshing, with a full flavour and a distinctive hoppy aroma.","Carlsberg Danish Pilsner is brewed with the principals learned from over 100 years brewing experience to produce a lager with distinctive citrus and floral hop aromas that delivers great depth of flavor, making it the perfect beer for those that value authentic and quality drinking experiences.",
Tuborg Beer Bottle 650ML,Beer,Domestic Beer, 425,N/A,Nepal,5.5%,650ML,Tuborg,https://liquorworld.com.np/product/tuborg-beer-bottle-650ml/,2023-09-25,"Tuborg is a bottom-fermented larger beer. It’s brewed on lager malt, a slightly roasted, bright type of malt which result is the well-known mild, fresh taste and aroma of flowers and grain. The beer is medium rich and lively with a moderate bitterness in the aftertaste.","Launched in Nepal in 1990 and enjoyed worldwide since 1880, Tuborg is the largest selling, most preferred and therefore the number 1 beer brand in Nepal.",Tuborg recently unveiled its new look with the innovative Pull-Off Cap for the first time in Nepal.
