title,category,sub_category,price,sale_price,country,alcohol,volume,brand,url,scrapped_time,desc_1,desc_2,desc_3
Bowmore 18 Years 700ML,Whisky,Single Malt Whisky," 15,000",N/A,Scotland,43%,700ML,Bowmore,https://liquorworld.com.np/product/bowmore-18-years-700ml/,2023-09-25,"Bowmore 18 Years Old Single Malt Scotch Whisky is a masterful combination of ripe fruit, dark chocolate and Islay smoke, cosseted away in the finest, hand-selected oak casks and allowed to mature at its own sedate pace which makes a most remarkable and perfectly balanced malts of its kind.","It possesses a unique maturity of which it owes to its time spent in the depths of the finest Oloroso and Pedro Ximenez casks. The latter giving a boost of richness, yet keeping the classic Bowmore balance of flavour. Uncork and unlock its layers of rich mocha, peat smoke, treacle toffee, dates, fruit oils and aromatic roasted coffee. This is one of the rarest whiskies, bottle of Bowmore 18 years old may be limited, but there is no end to its enjoyment.",On the Eye: Mellow mahogany.
Black Oak 750ML,Whisky,Domestic Whisky,"1,360","1,340",Nepal,34.23%,750ML,Black Oak,https://liquorworld.com.np/product/black-oak-750ml/,2023-09-25,"Black Oak Whisky is a Nepali brand whisky, an outstanding blend of premium malts and grain spirits, double matured in charred sherry oak casks. It has extraordinarily rich fruity flavors, with the charred oak contributing to nuttiness, delicious woody fragrance and a velvety deep peat smoky finish.",,
Bandipur 750ML,Whisky,Domestic Whisky,"5,000","4,750",Nepal,42.8%,750ML,Bandipur,https://liquorworld.com.np/product/bandipur-750ml/,2023-09-25,Bandipur – Nepal’s first 100% pure blended malt Scotch whisky.,,
Ballantine’s Finest 750ML,Whisky,Regular Whisky,"5,300","4,820",Scotland,43%,750ML,Ballantine’s,https://liquorworld.com.np/product/ballantines-finest-750ml/,2023-09-25,"Ballantine’s Finest is a complex, refined, elegant and one of the world’s best blended Scotch Whisky with 50 single malt and 4 single grain whiskies. It is regarded as the taste to satisfy a modern style. The blend’s light gold colour and unmistakable taste come from a complex mix of carefully selected malt and grain whiskies – all aged for many years in high-quality casks.",Colour: Light Gold,"Nose: Soft, elegant, heather honey aromas with a hint of spice."
Jack Daniel’s 500ML,Whisky,Bourbon Whisky,"4,180","3,970",United States of America,40%,500ML,Jack Daniel’s,https://liquorworld.com.np/product/jack-daniels-500ml/,2023-09-25,Jack Daniel’s is a brand of Tennessee Whiskies and top selling Amercian whisky brand in the world. Its distinct and unique taste comes from refining mellowing the freshly distilled whiskey drop by drop through 10 feet of sugar maple charcoal. The distilled whiskey is then matured in American Oak barrels hand-made by Jack Daniel’s themselves. The only major distiller in the world to make their own barrels.,"Each batch is made from marrying 170 barrels from all levels of the barrelhouses to achieve consistent colour and taste. Interesting fact – every drop of the world’s biggest selling whiskey comes from a single source, Lynchburg, Tennessee.","Nose: Balanced character, sweet, oaky, medium body"
Jack Daniel’s 1L,Whisky,Bourbon Whisky,"8,160","7,425",United States of America,40%,1L,Jack Daniel’s,https://liquorworld.com.np/product/jack-daniels-1l/,2023-09-25,Jack Daniel’s is a brand of Tennessee Whiskies and top selling Amercian whisky brand in the world. Its distinct and unique taste comes from refining mellowing the freshly distilled whiskey drop by drop through 10 feet of sugar maple charcoal. The distilled whiskey is then matured in American Oak barrels hand-made by Jack Daniel’s themselves. The only major distiller in the world to make their own barrels.,"Each batch is made from marrying 170 barrels from all levels of the barrelhouses to achieve consistent colour and taste. Interesting fact – every drop of the world’s biggest selling whiskey comes from a single source, Lynchburg, Tennessee.","Nose: Balanced character, sweet, oaky, medium body"
Grant’s Family Reserve 750ML,Whisky,Regular Whisky,"4,430","4,255",Scotland,40%,750ML,Grant’s,https://liquorworld.com.np/product/grants-family-reserve-750ml/,2023-09-25,"Grant’s Family Reserve, an award-winning flagship blended scotch whisky from William Grant & Sons, first created in 1898 and still made with the same inspiration, devotion and craftmanship. This whisky is the perfect blend of 25 grain and malt whiskies, in a product that puts forth its finesse, subtlety and balance.","Nose: Complex, clean with notes of ripe pear and summer fruits.",Taste: Balances vanilla sweetness with malty and light floral fragrances.
Golden Oak 750ML,Whisky,Domestic Whisky,"1,200","1,180",Nepal,34.23%,750ML,Golden Oak,https://liquorworld.com.np/product/golden-oak-750ml/,2023-09-25,"Golden Oak is a premium blended malt, blended with exquisite single malt and domestic grain spirits matured in the oak casks. The blend is more balanced, full bodied and easier to drink than their other counterparts in 40up segments.","The aromas are established on palate as well, followed by long, lingering finish of oakwood cask.","Golden Oak, with lower alcohol content (34.23%), can be drunk neat, though it could be served well on rocks."
Glenfiddich Malt 26 Years 700ML,Whisky,Single Malt Whisky,"71,350","60,650",Scotland,43%,700ML,Glenfiddich,https://liquorworld.com.np/product/glenfiddich-malt-26-years-700ml/,2023-09-25,"Glenfiddich Malt 26 Years 700ML is a rare, well-aged and well-crafted Single Malt Scotch Whisky that offers a rich blend of sweet and spicy flavours courtesy of bourbon. Made from 100% malted Scottish barley, the Scotch is distilled using their distinctively-shaped “swan neck” copper pot stills before being matured for 26 years in specially-selected ex-bourbon American oak casks, slowly absorbing its flavors before being brought to proof with pure spring water and finally bottled.","This Glenfiddich Excellence 26-Year-Old has a vibrant yet soft and delicate expression, with a deep and complex balance of sweetness and dry oak tannin. Bound to excite the palate and awaken the nose.",Colour: Rich golden.
Glenfiddich Malt 15 Years 750ML,Whisky,Single Malt Whisky,"14,315","12,850",Scotland,40%,750ML,Glenfiddich,https://liquorworld.com.np/product/glenfiddich-malt-15-years-750ml/,2023-09-25,"Glenfiddich Malt 15 Years is created using a technique pioneered by Malt Master and its warm, spicy flavours are transformed with the alchemy of the Solera Vat. Aged in European oak sherry casks and new oak casks. The whisky is mellowed in the unique Solera Vat, a large oak tun inspired by the sherry bodegas of Spain and Portugal.","Colour: Golden, a red hue.",Nose: An intriguingly complex aroma. Sweet heather honey and vanilla fudge combined with rich dark fruits.
Glenfiddich Malt 12 Years 750ML,Whisky,Single Malt Whisky,"9,767","8,750",Scotland,40%,750ML,Glenfiddich,https://liquorworld.com.np/product/glenfiddich-malt-12-years-750ml/,2023-09-25,"Glenfiddich Malt 12 Years is carefully matured in the finest American oak and European oak sherry casks for at least 12 years, it is mellowed in oak marrying tuns to create its sweet and subtle oak flavours.","Creamy with a long, smooth and mellow finish, 12-Year-Old is the perfect example of Glenfiddich’s unique Speyside style and is widely proclaimed the best dram in the valley.",Colour: Golden
Glen Elgin 12 Years 750ML,Whisky,Single Malt Whisky,"10,600","9,635",Scotland,43%,750ML,Glen Elgin,https://liquorworld.com.np/product/glen-elgin-12-years-750ml/,2023-09-25,"Glen Elgin 12 Years Old Single Malt Whisky is a soft, rounded Speyside whisky with fruit cake notes and malty characters. It has a slight tangerine sweetness alongside marzipan, vanilla oak and just a hint of smoke. Full-bodied, soft, malty and honeyed in the mouth. The finish is lengthy, slightly perfumed, with spicy oak.","Glen Elgin works best served in a traditional whisky glass, neat or with a little water.",
Dimple Deluxe 15 Years 1L,Whisky,Premium Whisky,"10,600","9,635",Scotland,43%,1L,Dimple,https://liquorworld.com.np/product/dimple-deluxe-15-years-1l/,2023-09-25,"Dimple Deluxe 15 Years Old is a Blended Scotch Whisky matured for minimum 15 years which is considered as special as the uniquely designed ‘pinched’ bottle that holds it. The main single malt of its composition is Glenckinchie, which offers mild flavour and aroma.","This whisky has a warming nose of spice and caramel, which develops into a well-balanced taste, with plenty honey and toffee, a little smoke and hint of oak.",Nose: Medium-body with warming notes of spice and caramel.
Dewar’s 12 Years 1L,Whisky,Premium Whisky,"8,800","8,250",Scotland,40%,1L,Dewar’s,https://liquorworld.com.np/product/dewars-12-years-1l/,2023-09-25,"Dewar’s 12-Year-Old Blended Scotch Whisky is a popular whisky produced by Dewar’s, a well-known Scottish distillery. It is part of their range of blended Scotch whiskies and is aged for a minimum of 12 years before being bottled and released for sale.","It is famous for its ‘double-aged’ blend, with six months of marrying in oak casks after initial maturation and blending for extra smoothness.","This Scotch whisky’s unique taste combines malt and whisky with dried tropical fruit, citrus and vanilla flavours."
Chivas Regal 25 Years 700ML,Whisky,Premium Whisky,"51,000","46,360",Scotland,40%,750ML,Chivas Regal,https://liquorworld.com.np/product/chivas-regal-25-years-700ml/,2023-09-25,"Chivas Regal 25 years old is the world’s first luxury whisky is an enticingly fruity blend. A smooth New York high society regular since 1909. Recently relaunched, with some rather smart new packaging, it is as good as ever with aromas of sweet orange and peach, followed by notes of marzipan and nuts which carries onto the palate along with hints of rich chocolate orange, and a fondant creaminess.",Colour: Rich gold.,Nose: Enticing fruity aromas of sweet orange and peach followed by notes of marzipan and nuts.
Chivas Regal 18 Years 750ML,Whisky,Premium Whisky,"13,800","12,545",Scotland,40%,750ML,Chivas Regal,https://liquorworld.com.np/product/chivas-regal-18-years-750ml/,2023-09-25,"Chivas Regal 18 Years is a complex yet refined whisky. An incredible blend of 85 flavour notes in every drop. The creation of Custodian Master Blender, intent on making a perfectly balanced and exceptionally smooth Scotch. Velvety, with hints of dark chocolate and multi-layered aromas of dried fruit and buttery toffee.","Colour: Intense, dark amber.","Nose: Rich, indulgent, multi-layered aromas with hints of dried fruits, buttery toffee and dark chocolate."
Ballantine’s 21 Years 700ML,Whisky,Premium Whisky,"24,000","21,820",Scotland,40%,700ML,Ballantine’s,https://liquorworld.com.np/product/ballantines-21-years-700ml/,2023-09-25,"Ballantine’s 21 Years Old is a premium Scotch Whisky introduced in 1993 by the Ballantine’s Distillery of Edinburgh. The rich, spiced flavour owes itself to the high proportion of Whiskies matured in European Oak casks. A warming blend of whiskies aged 21 years and over with an intense flavour that is truly impressive. Ballantine’s is renowned for smoothness, and this expression is an impeccable example.",Colour: Rich reddish gold.,"Nose: Rich, honey-sweet with hints of apple and floral aromas."
Aberlour 18 Years 700ML,Whisky,Single Malt Whisky,"24,500","22,275",Scotland,43%,700ML,Aberlour,https://liquorworld.com.np/product/aberlour-18-years-700ml/,2023-09-25,Aberlour 18 Years Old is spicy and luxurious Highland Single Malt Scotch Whisky.,"The mature, deep, spicy one: a deeper Sherry influence adds more spiciness and a liquorice tang. Greater age adds body and develops the distinctive fruitiness to a rich raisin character.",Colour: Auburn gold.
The Glenlivet Founder’s Reserve 750ML,Whisky,Single Malt Whisky,"7,400","6,730",Scotland,40%,750ML,The Glenlivet,https://liquorworld.com.np/product/the-glenlivet-founders-reserve-750ml/,2023-09-25,"The Glenlivet Founder’s Reserve Single Malt Scotch Whisky is inspired by legendary founder George Smith, an expression of both tradition and innovation. This expression is a skillful selection of casks enhances the signature fruity flavours of The Glenlivet with traditional oak casks being complemented by selective use of American first-fill casks to give a hint of creamy sweetness creating an exceptionally well-balanced and smooth malt.",Colour: Pale gold.,Cask: Traditional Oak and American First Fill.
Passport Scotch 1L,Whisky,Regular Whisky,"6,280","5,710",Scotland,40%,1L,Passport,https://liquorworld.com.np/product/passport-scotch-1l/,2023-09-25,"Passport Blended Scotch Whisky, originating from the Glen Keith distillery in Speyside, Scotland in the 1960’s.","This scotch whisky contains a blend of the finest malt and grain whiskies, carefully selected, matured and blended by an expert team. Matured in predominantly American oak barrels, the flavour of the final blend is both smooth and sweet with a fruity and creamy finish. Its green, rectangular bottle gives Passport an unmistakable look among all other Scotch whiskies.","Enjoyed this scotch whisky neat, over ice or as a long drink."
Johnnie Walker Blue Label 1L,Whisky,Premium Whisky,"38,000","34,545",Scotland,40%,1L,Johnnie Walker,https://liquorworld.com.np/product/johnnie-walker-blue-label-1l/,2023-09-25,"Johnnie Walker Blue Label is an unrivalled masterpiece – an exquisite combination of Scotland’s rarest and most exceptional whiskies. Only one in every ten thousand casks has the elusive quality, character and flavour to deliver the remarkable signature taste.","This Blended Scotch Whisky is created using a selection of rare casks from the Speyside and Highland distilleries – including delicate Cardhu and Clynelish, warm, rounded Benrinnes, as well as Islay malts for signature smokiness. An extraordinary whisky for extraordinary occasions.",Smell: Waves of spice give way to vanilla and honey.
Johnnie Walker Black Label 750ML,Whisky,Premium Whisky,"6,900","6,275",Scotland,43%,750ML,Johnnie Walker,https://liquorworld.com.np/product/johnnie-walker-black-label-750ml/,2023-09-25,"Johnnie Walker Black Label is the No.1 selling deluxe Blended Scotch Whisky in the world. This fine 12-year-old blend draws exceptional Scotch Whisky from across Scotland. Blending more than 40 of the finest malt and grain whiskies, it is a masterpiece of blending craftsmanship. The blend’s fruity foreground flavours give way to drier peaty tones with a long, smooth malt-driven finish. Johnnie Walker Black Label the benchmark Scotch. It has been described as the ”Everest of Whiskies”. Approximately 40 whiskies are blended to create Johnnie Walker Black Label.",Nose: Take in the luxurious scent of rich and tropical dark fruits with hints of sweet vanilla.,"Palate: Savour the depth of flavour developed from maturation in oak casks, combined with creamy toffee notes that come from grain whiskies."
Johnnie Walker Black Label 1L,Whisky,Premium Whisky,"9,000","8,180",Scotland,43%,1L,Johnnie Walker,https://liquorworld.com.np/product/johnnie-walker-black-label-1l/,2023-09-25,"Johnnie Walker Black Label is the No.1 selling deluxe Blended Scotch Whisky in the world. This fine 12-year-old blend draws exceptional Scotch Whisky from across Scotland. Blending more than 40 of the finest malt and grain whiskies, it is a masterpiece of blending craftsmanship. The blend’s fruity foreground flavours give way to drier peaty tones with a long, smooth malt-driven finish. Johnnie Walker Black Label the benchmark Scotch. It has been described as the ”Everest of Whiskies”. Approximately 40 whiskies are blended to create Johnnie Walker Black Label.",Nose: Take in the luxurious scent of rich and tropical dark fruits with hints of sweet vanilla.,"Palate: Savour the depth of flavour developed from maturation in oak casks, combined with creamy toffee notes that come from grain whiskies."
Johnnie Walker 18 Years 750ML,Whisky,Premium Whisky,"13,800","12,545",Scotland,40%,750ML,Johnnie Walker,https://liquorworld.com.np/product/johnnie-walker-18-years-750ml/,2023-09-25,"Johnnie Walker Aged 18 Years Whisky is made using whiskies that have matured for at least 18 years. Carefully chosen for their flavour and quality, these whiskies make for a wonderful combination of both classic and contemporary tastes – blending notes of citrus and fragrant almonds, with warm vanilla and a hint of tropical tangerines. When you’re looking for a whisky to make an occasion or celebration extra special, Johnnie Walker Aged 18 Years is an excellent choice.","Nose: A wonderfully rich aroma, combining notes of rich, sweet fruit with hints of toffee and caramel.","Palate: A comforting mix of warming, malty cereal and smooth creamy vanilla, with fragrant notes of almond and tropical tangerine."
Jim Bean White 750ML,Whisky,Bourbon Whisky,"5,550","5,160",United States of America,40%,750ML,Jim Beam,https://liquorworld.com.np/product/jim-bean-white-750ml/,2023-09-25,"Jim Beam White Label is one of the most well-known bourbon in the world, and is the flagship of the big Jim Beam distillery. Produced by a Master Distiller from the Beam Family and with a recipe dating back to the inception of the distillery in 1795. Jim Beam Bourbon derives its rich, satisfying flavour from a treasured family recipe and a minimum of four years ageing in new, charred oak barrels.","Jim Beam White Label Kentucky Straight Bourbon Whisky is elegant, smooth, refined. It has aroma of oaky vanilla, spicy backdrop. It has flavour of medium-bodied, mellow hints of caramel and vanilla. It has sweet, grain, oak, char and fruity taste made from the highest quality ingredients.",
Jameson Irish 750ML,Whisky,Premium Whisky,"5,660","5,150",Ireland,40%,750ML,Jameson,https://liquorworld.com.np/product/jameson-irish-750ml/,2023-09-25,"Jameson is the best-selling blended Irish Whisky in the world, has been around since 1780. Produced using unmalted and malted barley, maize, and Irish water from the Dungourney River local to the distillery. This fine Irish Whisky is triple distilled, matured in bourbon and oloroso sherry casks and aged for a minimum of 4 years, giving this whisky its signature and iconic smoothness.","Nose: A light floral fragrance, peppered with spicy wood and sweet notes.","Taste: The perfect balance of spicy, nutty and vanilla notes with hints of sweet sherry and exceptional smoothness."
Jim Beam White 1L,Whisky,Bourbon Whisky,"7,350","6,835",United States of America,40%,1L,Jim Beam,https://liquorworld.com.np/product/jim-beam-white-1l/,2023-09-25,"Jim Beam White Label is one of the most well-known bourbon in the world, and is the flagship of the big Jim Beam distillery. Produced by a Master Distiller from the Beam Family and with a recipe dating back to the inception of the distillery in 1795. Jim Beam Bourbon derives its rich, satisfying flavour from a treasured family recipe and a minimum of four years ageing in new, charred oak barrels.","Jim Beam White Label Kentucky Straight Bourbon Whisky is elegant, smooth, refined. It has aroma of oaky vanilla, spicy backdrop. It has flavour of medium-bodied, mellow hints of caramel and vanilla. It has sweet, grain, oak, char and fruity taste made from the highest quality ingredients.",
Jack Daniel’s Gentleman Jack 750ML,Whisky,Bourbon Whisky,"6,775","6,300",United States of America,40%,750ML,Jack Daniel’s,https://liquorworld.com.np/product/jack-daniels-gentleman-jack-750ml/,2023-09-25,Jack Daniel’s Gentleman Jack is a premium version of Jack Daniel’s Tennessee whisky exhibits impressive complexity and flavour with charcoal mellowed twice before and after the ageing process.,"Gentleman Jack, with its second charcoal mellowing, receives an additional “blessing” when it is charcoal mellowed again after reaching maturity – making it the only whiskey in the world to be charcoal mellowed twice, giving it ultimate smoothness.","Full-bodied with balanced oak flavour with notes of caramel and vanilla, exceptionally smooth finish."
Jameson Irish 1L,Whisky,Premium Whisky,"7,500","6,820",Ireland,40%,1L,Jameson,https://liquorworld.com.np/product/jameson-irish-1l/,2023-09-25,"Jameson is the best-selling blended Irish Whisky in the world, has been around since 1780. Produced using unmalted and malted barley, maize, and Irish water from the Dungourney River local to the distillery. This fine Irish Whisky is triple distilled, matured in bourbon and oloroso sherry casks and aged for a minimum of 4 years, giving this whisky its signature and iconic smoothness.","Nose: A light floral fragrance, peppered with spicy wood and sweet notes.","Taste: The perfect balance of spicy, nutty and vanilla notes with hints of sweet sherry and exceptional smoothness."
Jack Daniel’s Tennessee Fire 750ML,Whisky,Bourbon Whisky,"6,245","5,685",United States of America,35%,750ML,Jack Daniel’s,https://liquorworld.com.np/product/jack-daniels-tennessee-fire-750ml/,2023-09-25,Jack Daniel’s Tennessee Fire Whisky is a perfect blend of Jack Daniel’s Old No.7 Tennessee Whisky and a unique cinnamon liqueur. It’s a taste that’s truly one-of-a-kind but unmistakably Jack Daniel’s. Fiery hot with a distinctively smooth finish.,Colour: Reddish-amber.,"Nose: Distinctive Jack Daniel’s Tennessee Whiskey nose, balanced with indulgent bakery spice."
Jack Daniel’s Single Barrel 750ML,Whisky,Bourbon Whisky,"8,925","8,300",United States of America,45%,750ML,Jack Daniel’s,https://liquorworld.com.np/product/jack-daniels-single-barrel-select-750ml/,2023-09-25,"Jack Daniel’s Single Barrel Whisky – Each barrel is hand-selected for its one-of-a-kind flavor by the Jack Daniel’s Master Distiller and his team of Master Tasters. Only one out of every 100 barrels of Jack Daniel’s Old No. 7 Tennessee Whiskey maturing is selected for its big and bold, robust flavor. Every bottle carries its unique rick number, barrel number and bottling date. Bottled at 94-proof, Single Barrel Select layers subtle notes of caramel and spice with bright fruit notes and sweet aromatics for a Tennessee Whiskey with one-of-a-kind flavor.","Tasting Notes: Robust and complex, with rich toasted oak, complex barrel spices, rich caramel and subtle fruit with a finish that is warm and lingering.","Key Flavours: Rich caramel, Toasted oak, Subtle fruit, Barrel spices."
Jack Daniel’s 750ML,Whisky,Bourbon Whisky,"6,245","5,685",United States of America,40%,750ML,Jack Daniel’s,https://liquorworld.com.np/product/jack-daniels-750ml/,2023-09-25,Jack Daniel’s is a brand of Tennessee Whiskies and top selling Amercian whisky brand in the world. Its distinct and unique taste comes from refining mellowing the freshly distilled whiskey drop by drop through 10 feet of sugar maple charcoal. The distilled whiskey is then matured in American Oak barrels hand-made by Jack Daniel’s themselves. The only major distiller in the world to make their own barrels.,"Each batch is made from marrying 170 barrels from all levels of the barrelhouses to achieve consistent colour and taste. Interesting fact – every drop of the world’s biggest selling whiskey comes from a single source, Lynchburg, Tennessee.","Nose: Balanced character, sweet, oaky, medium body"
Ballantine’s Finest 1L,Whisky,Regular Whisky,"6,950","6,320",Scotland,43%,1L,Ballantine’s,https://liquorworld.com.np/product/ballantines-finest-1l/,2023-09-25,"Ballantine’s Finest is a complex, refined, elegant and one of the world’s best blended Scotch Whisky blended with 50 single malt and 4 single grain whiskies. It is regarded as the taste to satisfy a modern style. The blend’s light gold colour and unmistakable taste come from a complex mix of carefully selected malt and grain whiskies – all aged for many years in high-quality casks.",Colour: Light Gold,"Nose: Soft, elegant, heather honey aromas with a hint of spice."
Vat 69 1L,Whisky,Regular Whisky,"6,290","5,720",Scotland,40%,1L,VAT 69,https://liquorworld.com.np/product/vat-69-1l/,2023-09-25,Vat 69 is a blended Scotch Whisky produced by William Sanderson & Son Limited. Blended using 40 different malt and grain whiskies with each other at the optimal ripening stage to ensure the best blend.,"It is smooth, balanced spirit with upfront malty, heather sweetness and a lovely peat smoke savoury finish.","Nose: shows caramel, lemon zest, and soft wood spices."
Teacher’s 1L,Whisky,Regular Whisky,"6,475","6,020",Scotland,40%,1L,Teacher’s,https://liquorworld.com.np/product/teachers-1l/,2023-09-25,It is said that William Teacher would not give his name to his blend until he had found perfection. Highland Cream is that whisky.,It uses fully smoked peat single malt whisky. This gives it incredible depth and smoothness combined with a rich smokey undertone.,Truly a masterpiece.
Johnnie Walker Red Label 1L,Whisky,Regular Whisky,"6,990","6,355",Scotland,40%,1L,Johnnie Walker,https://liquorworld.com.np/product/johnnie-walker-red-label-1l/,2023-09-25,"Johnnie Walker Red Label Blended Scotch Whisky is the Pioneer Blend, the versatile one that has introduced to the world. Crafted from the four corners of Scotland, it crackles with spice and is bursting with vibrant, smoky flavours – followed by a mellow bed of vanilla, a fresh zestiness and the Johnnie Walker signature of a long, lingering, smoky finish.","It is a powerful mix of up to 30 malts and grains. It’s a combination of light whiskies from Scotland’s East Coast and more peaty whiskies from the West, expertly balanced to create an extraordinary depth of flavour. The best-selling Scotch Whisky around the globe. Perfect for parties and get-togethers, at home or going out.",Nose: Take in the spark of fresh zest from elegant Speyside and Highland malts in the aromas of our classic Johnnie Walker Red Label.
